{
  "schema_version": 1,
  "scenario_id": "S02_canary_1000qps_15min",
  "harness_version": "0.1.0",
  "loadgen_version": "0.1.0",
  "chart_version": "0.6.0",
  "image_tag": "v0.6.1",
  "git_commit": "PLACEHOLDER",
  "run_id": "PLACEHOLDER",
  "started_at": "2026-05-16T00:00:00Z",
  "duration_s": 900.0,
  "total_requests": 900000,
  "metrics": {
    "p50_ms": 9.0,
    "p95_ms": 150.0,
    "p99_ms": 800.0,
    "error_rate": 0.002,
    "throughput_qps": 1000.0,
    "recovery_time_s": null
  },
  "chaos_events": [],
  "verdict": "pass"
}
